<?xml version="1.0" encoding="utf-8" ?>
<cybershop xmlns:xsi="http://www.w3.org/2001/XMLSchema-instance"
           xsi:noNamespaceSchemaLocation="cybershop.xsd">

    <produit idProd="P100" idCategorie="C100">
        <nomProd>Mortal Kombat</nomProd>
        <descriptionProd>Jeux de combat mortel</descriptionProd>
        <prixProd>200</prixProd>
        <qutestockProd>200</qutestockProd>

    </produit>

    <commande idCom="O200" idProd="P100">
        <dateComm>
            <jj>12</jj>
            <mm>12</mm>
            <aa>2012</aa>
        </dateComm>
        <nomFournisseur>AE GAME</nomFournisseur>
        <adresseFourn>New York</adresseFourn>
        <qteCom>10</qteCom>
        <prixUnit>100</prixUnit>
    </commande>
    <categorieProd idCategorie="C100">
        <libeleCategie>Jouet</libeleCategie>
    </categorieProd>
</cybershop>